{
  "region": "Kerala",
  "property_types": ["flat", "house"],
  "stamp_duty": 0.08,
  "registration_fee": 0.02,
  "permit_fee": 0.0,
  "gst_applicable": true,
  "loan": { "max_ltv": 0.8, "interest_rate": 0.085, "tenure_years": 20 },
  "last_verified": "2025-07-01",
  "source": "https://keralaregistration.gov.in/",
  "updated_by": "ops-team",
  "data_version": "v1.0",
  "notes": "8% stamp duty, highest among southern states"
}
