{
  "region": "Singapore",
  "property_types": ["flat", "house"],
  "stamp_duty": 0.03,
  "registration_fee": 0.0,
  "gst_applicable": false,
  "loan": { "max_ltv": 0.75, "interest_rate": 0.04, "tenure_years": 25 },
  "last_verified": "2025-07-01",
  "source": "https://www.iras.gov.sg/taxes/stamp-duty",
  "updated_by": "community-user",
  "data_version": "v1.0",
  "notes": "BSD banded: 1% first S$180K, 2% next S$180K, 3% next S$640K, 4% above. ABSD applies for foreigners (60%)."
}
