{
  "region": "England",
  "property_types": ["flat", "house"],
  "stamp_duty": 0.05,
  "registration_fee": 0.0,
  "gst_applicable": false,
  "loan": { "max_ltv": 0.75, "interest_rate": 0.055, "tenure_years": 25 },
  "last_verified": "2025-07-01",
  "source": "https://www.gov.uk/stamp-duty-land-tax",
  "updated_by": "community-user",
  "data_version": "v1.0",
  "notes": "SDLT banded: 0% up to £250K, 5% £250K-£925K, 10% £925K-£1.5M, 12% above. Using 5% as default."
}
