{
  "region": "Ontario",
  "property_types": ["flat", "house"],
  "stamp_duty": 0.02,
  "registration_fee": 0.0,
  "gst_applicable": false,
  "loan": { "max_ltv": 0.8, "interest_rate": 0.055, "tenure_years": 25 },
  "last_verified": "2025-07-01",
  "source": "https://www.ontario.ca/page/land-transfer-tax",
  "updated_by": "community-user",
  "data_version": "v1.0",
  "notes": "Toronto has additional municipal LTT; first-time buyer rebates available"
}
