{
  "region": "New York",
  "property_types": ["flat", "house"],
  "stamp_duty": 0.004,
  "registration_fee": 0.0,
  "gst_applicable": false,
  "loan": { "max_ltv": 0.8, "interest_rate": 0.068, "tenure_years": 30 },
  "last_verified": "2025-07-01",
  "source": "https://www.tax.ny.gov/",
  "updated_by": "community-user",
  "data_version": "v1.0",
  "notes": "NYC has additional mansion tax above $1M; NYS transfer tax 0.4%"
}
