{
  "region": "Oman",
  "property_types": ["flat", "villa"],
  "stamp_duty": 0.03,
  "registration_fee": 0.005,
  "gst_applicable": false,
  "freehold_allowed": true,
  "loan": { "max_ltv": 0.7, "interest_rate": 0.06, "tenure_years": 20 },
  "last_verified": "2025-07-01",
  "source": "https://www.housing.gov.om/",
  "updated_by": "community-user",
  "data_version": "v1.0",
  "notes": "Freehold available in ITC zones like Muscat Hills, The Wave"
}
