{
  "region": "California",
  "property_types": ["flat", "house"],
  "stamp_duty": 0.0011,
  "registration_fee": 0.0,
  "gst_applicable": false,
  "loan": { "max_ltv": 0.8, "interest_rate": 0.07, "tenure_years": 30 },
  "last_verified": "2025-07-01",
  "source": "https://www.boe.ca.gov/",
  "updated_by": "community-user",
  "data_version": "v1.0",
  "notes": "Documentary transfer tax $1.10 per $1000 of value; varies by county"
}
